{
  "$schema": "../_schema/component.schema.json",
  "name": "Suggestion",
  "version": "0.13.0",
  "status": "stable",
  "deprecated": false,
  "summary": "Suggestion chip strip rendered above PromptInput (or beside an assistant message). One chip click submits the suggestion to the chat handler.",
  "props": {},
  "tokens": {
    "consumed": []
  },
  "a11y": {
    "wcag": [
      "1.4.3 Contrast (Minimum)",
      "2.1.1 Keyboard",
      "2.4.7 Focus Visible",
      "4.1.2 Name, Role, Value"
    ],
    "keyboard": [
      "Tab - focus",
      "ArrowLeft/Right - move between chips",
      "Enter - select chip"
    ],
    "minTouchTarget": "44x44",
    "rules": [
      "Visible focus ring required (outline + box-shadow per AGENTS.md hard rule 11).",
      "Honor prefers-reduced-motion and prefers-reduced-transparency.",
      "Color is never the only signal \u2014 pair with label, shape, or icon."
    ]
  },
  "rules": {
    "do": [],
    "dont": [
      "NEVER ship more than 4 suggestion chips. More creates choice paralysis.",
      "NEVER use Spring Green on a Suggestion chip \u2014 chips are neutral; the accent appears only on Submit.",
      "NEVER repeat a chip across turns. Suggestions are context-specific, not menu options.",
      "NEVER use Suggestion as a slash-command palette \u2014 that's PromptInputTools."
    ]
  },
  "examples": {
    "web-react": "./suggestion.tsx"
  }
}
